{
  "format_id": "xliff",
  "generated_at": "2026-07-15T16:55:28.579946+00:00",
  "generator": "compute_feature_coverage.py v1",
  "manifest_ref": "reports/spec-coverage/manifests/xliff-feature-manifest.json",
  "manifest_hash": "sha256:6049ce7b94e179878c244f075fb2cc20d9a4a8fed85ca98bc40748215a4d1f86",
  "coverage_summary": {
    "total": 5,
    "implemented": 5,
    "partial": 0,
    "missing": 0,
    "missing_unreasoned": 0
  },
  "items": [
    {
      "feature_id": "FACT-XLIFF-101",
      "name": "Structural inline markup preservation",
      "requirement_level": "mandatory",
      "status": "IMPLEMENTED",
      "evidence": "src/python/xliff/xliff_inline.py:InlineElement",
      "deferred_reason": null
    },
    {
      "feature_id": "FACT-XLIFF-102",
      "name": "Segment state write-back",
      "requirement_level": "mandatory",
      "status": "IMPLEMENTED",
      "evidence": "src/python/xliff/xliff_codec.py: (text match for 'segment_state')",
      "deferred_reason": null
    },
    {
      "feature_id": "FACT-XLIFF-103",
      "name": "Notes preservation",
      "requirement_level": "recommended",
      "status": "IMPLEMENTED",
      "evidence": "src/python/xliff/spec/file/file.py:notes",
      "deferred_reason": null
    },
    {
      "feature_id": "FACT-XLIFF-104",
      "name": "Group hierarchy preservation",
      "requirement_level": "recommended",
      "status": "IMPLEMENTED",
      "evidence": "src/python/xliff/xliff_codec.py: (text match for '\"group\"')",
      "deferred_reason": null
    },
    {
      "feature_id": "FACT-XLIFF-110",
      "name": "file/unit/segment core structure",
      "requirement_level": "mandatory",
      "status": "IMPLEMENTED",
      "evidence": "src/python/xliff/models.py:source_language",
      "deferred_reason": null
    }
  ],
  "gate_9_eligible": true
}
